{
  "id": "tilly_and_oscar_s_library_of_congress_search-v1",
  "metadata": {
    "title": "Tilly and Oscar's Library of Congress search",
    "theme": "How many books will they search",
    "gradeBand": "3-4",
    "factualStatus": "realistic",
    "tags": [
      "multiplication",
      "division",
      "equal groups",
      "equal sharing",
      "two-step",
      "approximation"
    ],
    "catalogOrder": 0,
    "publishedAt": "2026-08-06"
  },
  "dimension": {
    "kind": "count",
    "increaseLabel": "More",
    "decreaseLabel": "Fewer",
    "sameLabel": "The same",
    "increaseLabelLower": "more",
    "decreaseLabelLower": "fewer",
    "sameLabelLower": "the same"
  },
  "storyChrome": {
    "openingEyebrow": "Library search note",
    "startCta": "Open the search plan",
    "finishCta": "Close the search plan",
    "completionTitle": "Search plan complete",
    "stepProgressVerb": "model the book search",
    "groupNoun": "shelf",
    "learnerRole": "clue finder"
  },
  "story": {
    "briefTemplate": "Tilly and Oscar learned that is a secret message in one of the books at the Library of Congress. They know which floor and specific bookcase the book is on, but they don’t know the title. There are {quantity:library_shelves}, each with approximately {quantity:books_per_shelf}. If they were unlucky enough to find the clue in the last book, approximately how many books did each friend need to search?",
    "causalEvent": "Each shelf has approximately the same number of books, and the friends can split the search.",
    "closingNoteTemplate": "Each friend would need to search approximately {quantity:books_per_friend}."
  },
  "quantities": [
    {
      "id": "library_shelves",
      "label": {
        "child": "Shelves on the bookcase",
        "compact": "Shelves",
        "lowercase": "the shelves on the bookcase"
      },
      "unit": "shelves",
      "unitSingular": "shelf",
      "unitPlural": "shelves",
      "value": 6,
      "visibility": "given"
    },
    {
      "id": "books_per_shelf",
      "label": {
          "child": "Approximate number of books on each shelf",
          "compact": "Books each shelf",
          "lowercase": "the approximate number of books on each shelf"
      },
      "unit": "books",
      "unitSingular": "book",
      "unitPlural": "books",
      "value": 20,
      "visibility": "given"
    },
    {
      "id": "total_books",
      "label": {
          "child": "Approximate total books on the bookcase",
          "compact": "Total books",
          "lowercase": "the approximate total books on the bookcase"
      },
      "unit": "books",
      "unitSingular": "book",
      "unitPlural": "books",
      "value": null,
      "visibility": "find",
      "derived": {
        "formulaId": "groups_times_items_equals_total",
        "operands": {
          "groups": "library_shelves",
          "itemsPerGroup": "books_per_shelf"
        }
      },
      "expectedValueForFixture": 120
    },
    {
      "id": "searching_friends",
      "label": {
        "child": "Friends searching",
        "compact": "Friends",
        "lowercase": "the friends searching"
      },
      "unit": "friends",
      "unitSingular": "friend",
      "unitPlural": "friends",
      "value": 2,
      "visibility": "given"
    },
    {
      "id": "books_per_friend",
      "label": {
        "child": "Books each friend searches",
        "compact": "Books per friend",
        "lowercase": "the books each friend searches"
      },
      "unit": "books",
      "unitSingular": "book",
      "unitPlural": "books",
      "value": null,
      "visibility": "revealed_after_step",
      "derived": {
        "formulaId": "total_divided_by_groups_equals_items",
        "operands": {
          "total": "total_books",
          "groups": "searching_friends"
        }
      },
      "expectedValueForFixture": 60
    }
  ],
  "steps": [
    {
      "id": "find_total_books",
      "order": 1,
      "prompt": "Approximately how many books are on the bookcase?",
      "reasoningPrompt": "Each shelf has approximately the same number of books. What operation models equal groups?",
      "relationshipTemplateId": "multiplication_equal_groups",
      "roleToQuantityId": {
        "groups": "library_shelves",
        "itemsPerGroup": "books_per_shelf",
        "total": "total_books"
      },
      "goalQuantityId": "total_books",
      "acceptedEquationFormIds": [
        "groups_times_items_equals_total",
        "items_times_groups_equals_total"
      ],
      "preferredEquationFormId": "groups_times_items_equals_total",
      "expectedDirection": "scale",
      "operatorOptions": [
        "+",
        "-",
        "×",
        "÷"
      ],
      "backwardCheck": {
        "prompt": "Now let's divide the approximate total books on the bookcase by the number of shelves. Do we get the approximate number of books on each shelf?",
        "acceptedEquationFormIds": [
          "total_divided_by_groups_equals_items"
        ]
      }
    },
    {
      "id": "find_books_per_friend",
      "order": 2,
      "prompt": "If the clue is in the last book, approximately how many books does each friend need to search?",
      "reasoningPrompt": "The friends can split the total search evenly. What operation finds each friend’s share?",
      "relationshipTemplateId": "division_equal_sharing",
      "roleToQuantityId": {
        "total": "total_books",
        "groups": "searching_friends",
        "itemsPerGroup": "books_per_friend"
      },
      "goalQuantityId": "books_per_friend",
      "acceptedEquationFormIds": [
        "total_divided_by_groups_equals_items"
      ],
      "preferredEquationFormId": "total_divided_by_groups_equals_items",
      "expectedDirection": "split",
      "operatorOptions": [
        "+",
        "-",
        "×",
        "÷"
      ],
      "backwardCheck": {
        "prompt": "Multiply the books per friend by the friends searching. Do you return to the total books?",
        "acceptedEquationFormIds": [
          "groups_times_items_equals_total"
        ]
      }
    }
  ],
  "operatorExperiments": [
    {
      "stepId": "find_total_books",
      "operator": "+",
      "narrativeFit": "different_question",
      "alternateWorldTemplate": "Adding would count shelves and books side by side, not every equal group."
    },
    {
      "stepId": "find_total_books",
      "operator": "-",
      "narrativeFit": "different_story",
      "alternateWorldTemplate": "Subtracting would fit a story where some books were removed."
    },
    {
      "stepId": "find_total_books",
      "operator": "×",
      "narrativeFit": "actual",
      "visualModel": "repeated_groups_grid",
      "alternateWorldTemplate": "This matches the story: every shelf has approximately {quantity:books_per_shelf}."
    },
    {
      "stepId": "find_total_books",
      "operator": "÷",
      "narrativeFit": "different_question",
      "visualModel": "equal_shares_tray",
      "alternateWorldTemplate": "Dividing would fit a different question about sharing books equally."
    },
    {
      "stepId": "find_books_per_friend",
      "operator": "+",
      "narrativeFit": "different_question",
      "alternateWorldTemplate": "Adding would count books and friends side by side, not share the search."
    },
    {
      "stepId": "find_books_per_friend",
      "operator": "-",
      "narrativeFit": "different_story",
      "alternateWorldTemplate": "Subtracting would fit a story where some books were removed from the search."
    },
    {
      "stepId": "find_books_per_friend",
      "operator": "×",
      "narrativeFit": "different_question",
      "visualModel": "repeated_groups_grid",
      "alternateWorldTemplate": "Multiplying would fit a different question about equal groups of books per friend."
    },
    {
      "stepId": "find_books_per_friend",
      "operator": "÷",
      "narrativeFit": "actual",
      "visualModel": "equal_shares_tray",
      "alternateWorldTemplate": "This matches the story: the total books are split between {quantity:searching_friends}."
    }
  ],
  "recap": {
    "headline": "How the friends split the book search",
    "causalChain": [
      "{quantity:library_shelves} with approximately {quantity:books_per_shelf} each made approximately {quantity:total_books}.",
      "{quantity:total_books} split between {quantity:searching_friends} gives approximately {quantity:books_per_friend}."
    ],
    "calcFromStepId": "find_books_per_friend",
    "dataQuestion": {
      "prompt": "What does {quantity:books_per_friend} represent in the library search model?",
      "correctQuantityId": "books_per_friend",
      "distractorQuantityIds": [
        "library_shelves",
        "total_books",
        "searching_friends"
      ],
      "correctFeedback": "Right. {quantity:books_per_friend} is approximately how many books each friend searches.",
      "incorrectFeedback": "That amount is each friend’s share of the search: {quantity:books_per_friend}."
    }
  }
}
